{
  "$schema": "https://json-schema.org/draft/2020-12/schema",
  "$id": "urn:soksak:spec:release:0.0.1",
  "title": "soksak plugin, sidecar, or kit release 0.0.1",
  "type": "object",
  "additionalProperties": false,
  "minProperties": 6,
  "maxProperties": 6,
  "required": ["spec", "source", "dependencies", "artifacts", "reports"],
  "properties": {
    "spec": { "const": "soksak-spec-release@0.0.1" },
    "plugin": { "$ref": "#/$defs/reference" },
    "sidecar": { "$ref": "#/$defs/reference" },
    "kit": { "$ref": "#/$defs/reference" },
    "source": { "$ref": "#/$defs/source" },
    "dependencies": { "type": "array", "uniqueItems": true, "items": { "$ref": "#/$defs/dependency" } },
    "artifacts": { "type": "array", "minItems": 1, "uniqueItems": true, "items": { "$ref": "#/$defs/artifact" } },
    "reports": { "type": "array", "minItems": 1, "uniqueItems": true, "items": { "$ref": "#/$defs/integrity" } }
  },
  "not": { "type": "object", "properties": { "plugin": false, "sidecar": false, "kit": false } },
  "dependentSchemas": {
    "plugin": { "type": "object", "properties": { "artifacts": { "type": "array", "maxItems": 1, "items": { "$ref": "#/$defs/pluginArtifact" } } } },
    "kit": { "type": "object", "properties": { "artifacts": { "type": "array", "maxItems": 1, "items": { "$ref": "#/$defs/kitArtifact" } } } },
    "sidecar": { "type": "object", "properties": { "artifacts": { "type": "array", "items": { "$ref": "#/$defs/sidecarArtifact" } } } }
  },
  "$defs": {
    "componentId": { "type": "string", "pattern": "^[a-z0-9][a-z0-9-]{0,127}$" },
    "reference": { "type": "object", "additionalProperties": false, "required": ["id", "version"], "properties": { "id": { "$ref": "#/$defs/componentId" }, "version": { "const": "0.0.1" } } },
    "sha256": { "type": "string", "pattern": "^[a-f0-9]{64}$" },
    "commit": { "type": "string", "pattern": "^[a-f0-9]{40}$" },
    "repository": { "type": "string", "pattern": "^https://github\\.com/[A-Za-z0-9](?:[A-Za-z0-9-]{0,37}[A-Za-z0-9])?/[A-Za-z0-9][A-Za-z0-9._-]{0,99}$" },
    "releaseAsset": { "type": "string", "pattern": "^https://github\\.com/[A-Za-z0-9](?:[A-Za-z0-9-]{0,37}[A-Za-z0-9])?/[A-Za-z0-9][A-Za-z0-9._-]{0,99}/releases/download/v0\\.0\\.1/[a-z0-9][a-z0-9._-]{0,254}$" },
    "source": { "type": "object", "additionalProperties": false, "required": ["repository", "commit"], "properties": { "repository": { "$ref": "#/$defs/repository" }, "commit": { "$ref": "#/$defs/commit" } } },
    "integrity": { "type": "object", "additionalProperties": false, "required": ["url", "sha256"], "properties": { "url": { "$ref": "#/$defs/releaseAsset" }, "sha256": { "$ref": "#/$defs/sha256" } } },
    "dependency": { "type": "object", "additionalProperties": false, "minProperties": 2, "maxProperties": 2, "required": ["scope"], "properties": { "plugin": { "$ref": "#/$defs/reference" }, "sidecar": { "$ref": "#/$defs/reference" }, "kit": { "$ref": "#/$defs/reference" }, "scope": { "enum": ["runtime", "build"] } }, "not": { "type": "object", "properties": { "plugin": false, "sidecar": false, "kit": false } } },
    "target": { "enum": ["any", "aarch64-apple-darwin", "aarch64-pc-windows-msvc", "aarch64-unknown-linux-gnu", "aarch64-unknown-linux-musl", "x86_64-apple-darwin", "x86_64-pc-windows-msvc", "x86_64-unknown-linux-gnu", "x86_64-unknown-linux-musl"] },
    "nativeTarget": { "enum": ["aarch64-apple-darwin", "aarch64-pc-windows-msvc", "aarch64-unknown-linux-gnu", "aarch64-unknown-linux-musl", "x86_64-apple-darwin", "x86_64-pc-windows-msvc", "x86_64-unknown-linux-gnu", "x86_64-unknown-linux-musl"] },
    "artifact": { "type": "object", "additionalProperties": false, "required": ["target", "url", "sha256", "format", "manifest"], "properties": { "target": { "$ref": "#/$defs/target" }, "url": { "$ref": "#/$defs/releaseAsset" }, "sha256": { "$ref": "#/$defs/sha256" }, "format": { "enum": ["tar.gz", "tgz"] }, "manifest": { "enum": ["plugin.json", "sidecar.json", "package.json"] } } },
    "pluginArtifact": { "allOf": [{ "$ref": "#/$defs/artifact" }, { "type": "object", "properties": { "target": { "const": "any" }, "manifest": { "const": "plugin.json" } } }] },
    "kitArtifact": { "allOf": [{ "$ref": "#/$defs/artifact" }, { "type": "object", "properties": { "target": { "const": "any" }, "manifest": { "const": "package.json" } } }] },
    "sidecarArtifact": { "allOf": [{ "$ref": "#/$defs/artifact" }, { "type": "object", "properties": { "target": { "$ref": "#/$defs/nativeTarget" }, "manifest": { "const": "sidecar.json" } } }] }
  }
}
