{
  "spec": "soksak-spec-release@0.0.1",
  "sidecar": { "id": "weather-sidecar", "version": "0.0.1" },
  "source": { "repository": "https://github.com/example/weather-sidecar", "commit": "bbbbbbbbbbbbbbbbbbbbbbbbbbbbbbbbbbbbbbbb" },
  "dependencies": [],
  "artifacts": [
    { "target": "aarch64-apple-darwin", "url": "https://github.com/example/weather-sidecar/releases/download/v0.0.1/weather-sidecar-aarch64-apple-darwin.tar.gz", "sha256": "2222222222222222222222222222222222222222222222222222222222222222", "format": "tar.gz", "manifest": "sidecar.json" },
    { "target": "x86_64-unknown-linux-gnu", "url": "https://github.com/example/weather-sidecar/releases/download/v0.0.1/weather-sidecar-x86_64-unknown-linux-gnu.tar.gz", "sha256": "3333333333333333333333333333333333333333333333333333333333333333", "format": "tar.gz", "manifest": "sidecar.json" }
  ],
  "reports": [
    { "url": "https://github.com/example/weather-sidecar/releases/download/v0.0.1/sidecar-interface.conformance.json", "sha256": "cccccccccccccccccccccccccccccccccccccccccccccccccccccccccccccccc" },
    { "url": "https://github.com/example/weather-sidecar/releases/download/v0.0.1/sidecar-kind.conformance.json", "sha256": "dddddddddddddddddddddddddddddddddddddddddddddddddddddddddddddddd" },
    { "url": "https://github.com/example/weather-sidecar/releases/download/v0.0.1/sidecar-release.conformance.json", "sha256": "eeeeeeeeeeeeeeeeeeeeeeeeeeeeeeeeeeeeeeeeeeeeeeeeeeeeeeeeeeeeeeee" }
  ]
}
